"सीमा आयोग का प्रमुख कार्य क्या था", "दोनों राज्यों की सीमाओं का निर्धारण", "भाषाई क्षेत्रों का विभाजन", "मुख्यमंत्रियों का चयन", "राजधानी का चुनाव", "दोनों राज्यों की सीमाओं का निर्धारण"
"सीमा आयोग ने अपनी रिपोर्ट कब दी थी", "31 मई 1966", "23 अप्रैल 1966", "28 सितंबर 1966", "1 नवंबर 1966", "31 मई 1966"
"सीमा आयोग ने अपनी रिपोर्ट किस तारीख को प्रस्तुत की", "31 मई 1966", "23 अप्रैल 1966", "28 सितंबर 1966", "1 नवंबर 1966", "31 मई 1966"
"सीमा आयोग की रिपोर्ट के हिसाब से कौन से जिले हरियाणा में मिलाए जाने चाहिए थे", "हिसार महेंद्रगढ़ गुडगाँव रोहतक करनाल नरवाना तहसील अंबाला जगाधरी और खराड तहसील", "फरीदाबाद पलवल नूह", "पानीपत सोनीपत जींद", "उपरोक्त सभी", "हिसार महेंद्रगढ़ गुडगाँव रोहतक करनाल नरवाना तहसील अंबाला जगाधरी और खराड तहसील"
"सीमा आयोग की रिपोर्ट में हरियाणा में शामिल करने के लिए किन क्षेत्रों का उल्लेख किया गया था", "हिसार महेंद्रगढ़ गुडगाँव रोहतक करनाल नरवाना तहसील अंबाला जगाधरी और खराड तहसील", "अंबाला यमुनानगर कुरुक्षेत्र", "हिसार फतेहाबाद सिरसा", "भिवानी दादरी चरखी", "हिसार महेंद्रगढ़ गुडगाँव रोहतक करनाल नरवाना तहसील अंबाला जगाधरी और खराड तहसील"
"नरवाना तहसील किस जिले में आती थी", "संगरूर", "पटियाला", "लुधियाना", "जालंधर", "संगरूर"
"नरवाना तहसील पहले पंजाब के किस जिले का हिस्सा थी", "संगरूर", "लुधियाना", "पटियाला", "अमृतसर", "संगरूर"
"अंबाला जगाधरी और खराड तहसील में कौन सा शहर शामिल था", "चंडीगढ़", "अंबाला", "यमुनानगर", "पंचकूला", "चंडीगढ़"
"सीमा आयोग की रिपोर्ट में अंबाला जगाधरी और खराड तहसील के साथ किस शहर को हरियाणा में मिलाने की सिफारिश की गई थी", "चंडीगढ़", "अंबाला", "यमुनानगर", "पंचकूला", "चंडीगढ़"
"इस रिपोर्ट के आधार पर 28 सितंबर 1966 को हरियाणा में कौन से जिले और हिस्सों को शामिल किया गया", "रोहतक गुडगाँव करनाल महेंद्रगढ़ जींद नरवाना अंबाला जगाधरी नारायणगढ़ और मणीमाजरा के कुछ हिस्से", "हिसार महेंद्रगढ़ गुडगाँव रोहतक करनाल", "अंबाला जगाधरी और खराड", "उपरोक्त सभी", "रोहतक गुडगाँव करनाल महेंद्रगढ़ जींद नरवाना अंबाला जगाधरी नारायणगढ़ और मणीमाजरा के कुछ हिस्से"
"28 सितंबर 1966 को सीमा आयोग की रिपोर्ट के आधार पर हरियाणा में किन प्रमुख क्षेत्रों को शामिल किया गया", "रोहतक गुडगाँव करनाल महेंद्रगढ़ जींद नरवाना अंबाला जगाधरी नारायणगढ़ और मणीमाजरा के कुछ हिस्से", "अंबाला यमुनानगर कुरुक्षेत्र", "हिसार फतेहाबाद सिरसा", "भिवानी दादरी चरखी", "रोहतक गुडगाँव करनाल महेंद्रगढ़ जींद नरवाना अंबाला जगाधरी नारायणगढ़ और मणीमाजरा के कुछ हिस्से"
"हरियाणा और पंजाब का हाई कोर्ट गठन के समय क्या था", "एक ही रखा गया", "अलग-अलग किया गया", "चंडीगढ़ में स्थानांतरित किया गया", "दिल्ली में स्थानांतरित किया गया", "एक ही रखा गया"
"हरियाणा के गठन के समय पंजाब और हरियाणा का उच्च न्यायालय किस स्थिति में था", "एक ही रखा गया था", "अलग-अलग स्थापित किए गए थे", "चंडीगढ़ में स्थानांतरित किया गया था", "दिल्ली में स्थानांतरित किया गया था", "एक ही रखा गया था"
"हरियाणा का गठन किस तारीख को हुआ था", "1 नवंबर 1966", "23 अप्रैल 1966", "31 मई 1966", "28 सितंबर 1966", "1 नवंबर 1966"
"हरियाणा राज्य की स्थापना किस दिनांक को हुई थी", "1 नवंबर 1966", "23 अप्रैल 1966", "31 मई 1966", "28 सितंबर 1966", "1 नवंबर 1966"
"हरियाणा का गठन किस अनुच्छेद और धारा के तहत हुआ", "अनुच्छेद 135(3) और धारा-3", "अनुच्छेद 3 और धारा-135(3)", "अनुच्छेद 135 और धारा-3", "अनुच्छेद 3 और धारा-135", "अनुच्छेद 135(3) और धारा-3"
"भारतीय संविधान के किस अनुच्छेद और धारा के तहत हरियाणा राज्य का गठन किया गया", "अनुच्छेद 135(3) और धारा-3", "अनुच्छेद 3 और धारा-135(3)", "अनुच्छेद 135 और धारा-3", "अनुच्छेद 3 और धारा-135", "अनुच्छेद 135(3) और धारा-3"
"पंजाब री-ऑर्गेनाइजेशन एक्ट के हिसाब से पंजाब के अंदर से कौन से दो अलग राज्य बनाए गए", "हरियाणा और हिमाचल प्रदेश", "हरियाणा और पंजाब", "पंजाब और हिमाचल प्रदेश", "हरियाणा और दिल्ली", "हरियाणा और हिमाचल प्रदेश"
"किस अधिनियम के तहत पंजाब से हरियाणा और हिमाचल प्रदेश दो अलग राज्य बनाए गए", "पंजाब री-ऑर्गेनाइजेशन एक्ट", "स्टेट्स रीऑर्गेनाइजेशन एक्ट", "हरियाणा फॉर्मेशन एक्ट", "पंजाब & हरियाणा मर्जर एक्ट", "पंजाब री-ऑर्गेनाइजेशन एक्ट"
"किस कारण से HR 1 नवंबर 1966 में नए राज्य के रूप में उभरकर आया", "पंजाब री-ऑर्गेनाइजेशन एक्ट", "सच्चर फार्मला", "फजल अली आयोग", "सीमा आयोग", "पंजाब री-ऑर्गेनाइजेशन एक्ट"
"हरियाणा के एक नवंबर 1966 को नए राज्य के रूप में स्थापित होने का प्रमुख कारण क्या था", "पंजाब री-ऑर्गेनाइजेशन एक्ट का लागू होना", "सच्चर फार्मला का अनुमोदन", "फजल अली आयोग की सिफारिशें", "सीमा आयोग की रिपोर्ट", "पंजाब री-ऑर्गेनाइजेशन एक्ट का लागू होना"